norm_es_score,isbn,book_title,book_author,year_of_publication,publisher,summary,category
4.469974346532547,0425164071,The Maiden's Tale (Sister Frevisse Medieval Mysteries (Paperback)),Margaret Frazer,1998,Berkley Publishing Group,"On her way to London, Sister Frevisse stays with her wealthy cousin
Alice, wife of the earl of Suffolk, and finds herself swept up in the
dangerous political machinations of the duc of Orleans and King Henry
VI. Original.",['fiction']
4.469974346532547,0312300875,Corpse Candle: A Medieval Mystery Featuring Hugh Corbett,P. C. Doherty,2002,St. Martin's Minotaur,"But Corbett disregards the tales, suspecting that someone much closer
to home is responsible for the bloody acts.",['fiction']
4.469974346532547,0425183246,The Clerk's Tale (Sister Frevisse Medieval Mysteries (Hardcover)),Margaret Frazer,2002,Prime Crime,"When Dame Frevisse accompanies her priores on a mercy mission to a
nunnery, she finds herself embroiled in a deadly dispute over an
inheritance, a fierce family feud, and the mystery involved with a
brutal murder.",['fiction']
4.469974346532547,0195084055,Growing Up in Medieval London: The Experience of Childhood in History,Barbara A. Hanawalt,1993,Oxford University Press,"Details what childhood was like in thirteenth- and fourteenth-century
London, discussing the importance of literacy and education, even for
girls, and provides narratives of individual children",['history']
4.469974346532547,0521461561,The Medieval Super-Companies: A Study of Peruzzi Company of Florence,Edwin S. Hunt,1994,Cambridge University Press,"A detailed 1994 description and history of one of the most famous
companies of the early fourteenth century, the Peruzzi Company.",['business & economics']
4.173738363833429,0674443624,Image on the Edge: The Margins of Medieval Art (Essays in Art and Culture),Michael Camille,1993,Harvard University Press,"Viewing marginalia in their proper social and cultural context,
Camille reveals scandalous and subversive aspects, as well as
apparently paradoxical stabilizing functions.",['literary collections']
4.173738363833429,0345447069,Walking to Canterbury: A Modern Journey Through Chaucer's Medieval England,Jerry Ellis,2003,Ballantine Books,"Walking to Canterbury is Jerry Ellis&#39;s moving and fascinating
account of his own modern pilgrimage along that famous path.",['travel']
4.173738363833429,0866982906,"Beowulf and the Critics (Medieval & Renaissance Texts & Studies, Vol. 248)",J. R. R. Tolkien,2002,Arizona Center for Medieval and Renaissance S,"This critical edition of Beowulf and the critics presents both
unpublished versions of Tolkien&#39;s lecture, each substantially
different from the other and from the final, published essay.",['literary criticism']
4.173738363833429,0486290603,"Medieval Costume in England and France: The 13th, 14th and 15th Centuries",Mary G. Houston,1996,Dover Publications,"Splendid pictorial documentation, carefully researched, of royal
apparel, ecclesiastical dress and vestments, academic and legal
garments, and civilian dress of all classes.",['design']
4.173738363833429,0801485487,"Strong of Body, Brave and Noble: Chivalry and Society in Medieval France",Constance Brittain Bouchard,1998,Cornell University Press,"This book explores the nature of the nobility, focusing on France in
the High Middle Ages (11th-13th centuries).",['history']
4.171028469946605,0691020477,Origins of the Kabbalah,Gershom Gerhard Scholem,1991,Princeton University Press,"The book is a contribution not only to the history of Jewish medieval
mysticism but also to the study of medieval mysticism in general and
will be of interest to historians and psychologists, as well as to
students of the history of ...",['religion']
4.133894941969433,0446611123,The Warrior,Claire Delacroix,2004,Warner Books,The final book in a new medieval romance trilogy.,['fiction']
4.111215154770081,0486247775,Old English Tile Designs for Artists and Craftspeople (Dover Pictorial Archive Series),Carol Belanger Grafton,1985,Dover Publications,"Over 150 engravings of original ceramic paving tiles from medieval
cathedrals and monasteries — geometrics, mosaics, Gothic and
Romanesque themes, rich medieval imagery.",['architecture']
4.0180192369371,0803703724,The Unicorn Alphabet,Marianno Mayer,1989,Penguin USA,"The classic medieval legend of the unicorn serves as a motif for the
alphabet.",['english language']
3.9965907315594107,0415073294,Childhood in the Middle Ages,Shulamith Shahar,1992,Routledge,"This wide-ranging study considers the medieval view of children, as
well as images of childhood, attitudes towards children, and the
concept of the stages of childhood in medieval culture, from the
nobility to the peasantry.",['children']
3.9143273471998006,0195124987,Common Women: Prostitution and Sexuality in Medieval England (Studies in the History of Sexuality),Ruth Mazo Karras,1998,Oxford University Press,"This important work will be of interest to scholars and students of
history, women&#39;s studies, and the history of sexuality.",['history']
3.9143273471998006,0395981395,Queen Eleanor: Independent Spirit of the Medieval World : A Biography of Eleanor of Aquitaine,Polly Schoyer Brooks,1999,Houghton Mifflin Company,"A biography of the twelfth-century queen, first of France, then of
England, who was the very lively wife of Henry II and mother of
several notable sons, including Richard the Lionhearted.",['juvenile nonfiction']
3.9143273471998006,0521645182,The Place of the Dead : Death and Remembrance in Late Medieval and Early Modern Europe,Bruce Gordon,2000,Cambridge University Press,"This book provides a comprehensive account of attitudes towards the
dead and their &#39;placing&#39;.",['history']
3.9143273471998006,0802065481,"A Concise Anglo-Saxon Dictionary (Medieval Academy Reprints for Teaching, 14)",J. R. Clark Hall,1984,University of Toronto Press,"Purely poetic words and words not common in prose are indicated, and
references are given to the passages in which they occur. First
published in 1894, this is a reprint of the fourth edition (Cambridge
University Press, 1960).",['reference']
3.908463697496414,1903517001,False Ambassador,Christopher Harris,2002,"Dedalus, Ltd","Beginning in 1428, this tale recreates a medieval world on the cusp of
civilization.",['fiction']
3.804723625378584,0898704529,Christianity for Modern Pagans: Pascal's Pensees,Peter Kreeft,1993,Ignatius Press,"Peter Kreeft believes that Baise Pascal is the first post-medieval
apologist.",['religion']
3.7063478582931855,0440055369,Mazes and monsters: A novel,Rona Jaffe,1981,Delacorte Press,"A college student who was part of a group involved in a medieval war
game disappears.",['college students']
3.7063478582931855,0345277600,"Sir Gawain and the Green Knight, Pearl, Sir Orfeo",J. R. R. Tolkien,1988,Del Rey Books,"The scholar-fantacist offers faithful translations of the three
classics of Medieval English verse",['fiction']
3.7063478582931855,044021565X,Where Magic Dwells,Rexanne Becnel,1994,Dell Publishing Company,"An English knight wins the love of a proud, independent Welsh
noblemwoman in medieval Britain.",['fiction']
3.7063478582931855,0425087573,The Prophecies of Nostradamus: The Man Who Saw Tomorrow,Erika Cheetham,1990,Berkley Publishing Group,"Provides the predictions of the medieval French physican and astrolger
edited and interpreted for the modern reader.",['philosophy']
3.7063478582931855,0517671077,"The History of Chivalry and Armor: With Descriptions of the Feudal System, the Practices of Knighthood, the Tournament, and Trials by Single Combat",F. Kottenkamp,1988,Random House Value Pub,"Describes the feudal system, explains the concept of chivalry, and
shows medieval armor and weapons",['social science']
3.7063478582931855,0921285043,Princess Frownsalot,John Bianchi,1985,Firefly Books Ltd,"A hilarious medieval tale about a princess whose frown freezes to her
face.",['juvenile fiction']
3.6852751238262846,0674400011,A History of Private Life: Revelations of the Medieval World (History of Private Life (Paperback)),Georges Duby,1993,Belknap Press,"The second volume of A History of Private Life contains much rich and
colourful detail culled from a considerable variety of sources.",['history']
3.6852751238262846,0486253406,Early Medieval Designs from Britain for Artists and Craftspeople (Pictorial Archive Series),Eva Wilson,1987,Dover Publications,"Artists and craftspeople will find this book a fertile source of
design inspiration from a decorative-arts tradition of dazzling
virtuosity, reflecting the rich intermingling of Roman, Anglo-Saxon,
Celtic, Germanic, Viking and other early ...",['design']
3.6129316155746873,0521785766,Magic in the Middle Ages (Canto),Richard Kieckhefer,2000,Cambridge University Press,"A fascinating 2000 study of natural and demonic magic within the broad
context of medieval culture.",['history']
3.6129316155746873,0140444467,The Poem of the Cid: A Bilingual Edition With Parallel Text (Penguin Classics),Ian Michael,1985,Penguin Books,"The medieval epic poem is presented in parallel Spanish and English
text with English introduction and notes",['poetry']
3.6129316155746873,0899663818,A Connecticut Yankee in King Arthur's Court,Mark Twain,1984,Buccaneer Books,"Tells the story of a Connecticut workman who finds himself transported
back to medieval England",['fiction']
3.6129316155746873,080946425X,"Fury of the Northmen: Time Frame, Ad 800-1000 (Time Frame)",Time Life,1988,Time-Life Books,"Describes the cultures of the Vikings, the Japanese Byzantium, and the
mound builders of the Americas during the medieval period",['history']
3.5241082731094133,0486243451,The Book of Kells: Selected Plates in Full Color,Blanche Cirker,1982,Dover Publications,"Vividly reproduces 32 pages from a medieval Irish Bible illustrated
with elaborate and colorful drawings",['art']
3.5241082731094133,0897332202,The Green Man,Kingsley Amis,1991,Academy Chicago Publishers,"The present-day owner of a medieval coaching inn is witness to the
renascence of a seventeenth-century murder suspect",['fiction']
3.5241082731094133,0451158814,Chandra,Catherine Coulter,1985,Onyx Books,"I hope you enjoy all of the medieval novels as much as I enjoyed
writing them.",['fiction']
3.5241082731094133,1587680092,Francis of Assisi: A Revolutionary Life,Adrian House,2001,HiddenSpring,"Traces the life and teachings of St. Francis of Assisi and describes
his impact on society in medieval Europe.",['biography & autobiography']
3.5241082731094133,0521794234,Language and History in the Early Germanic World,D. H. Green,2000,Cambridge University Press,"This book presents linguistic evidence for many aspects of pre-
Christian and early medieval European culture.",['language arts & disciplines']
3.5241082731094133,0394710231,THE POISON ORACLE,PETER DICKINSON,1982,Pantheon,"A chimpanzee that is able to communicate with the use of plastic
symbols is the sole witness to a murder in a medieval Arab kingdom",['fiction']
3.5241082731094133,0671743945,MACBETH,William Shakespeare,1991,Washington Square Press,"Spine title: Macbeth. Shakespeare&#39;s tragedy of prophecy and royal
murder in medieval Scotland.",['drama']
3.5241082731094133,0333464761,Macmillan Anthologies of English Literature: The Middle Ages,Michael Alexander,1989,Trans-Atlantic Pubns,"This volume starts with the writings of Bede and covers the range of
Medieval literature up to the time of Thomas More.",['literary criticism']
3.5241082731094133,0810928892,Discoveries: Alchemy : The Great Secret (Discoveries),Andrea Aromatico,2000,Harry N Abrams,"Medieval alchemists, forerunners of today&#39;s chemists, sought to
transmute base metals into gold.",['art']
3.4815483383649046,0156006022,Sun Dancing: Life in a medieval Irish monastery and how Celtic spirituality influenced the world,Geoffrey Moorhouse,1999,Harvest Books,"A fictionalized history of fourth-century Irish monks describes their
spirituality and their influence on other areas of the world",['fiction']
3.4815483383649046,0810965720,Art of the Book : From Medieval Manuscript to Graphic Novel (Victoria and Albert Museum Studies),James Bettley,2001,Victoria & Albert Museum,"A showcase of book bindings, illuminated manuscripts, comics, and
children&#39;s books found at London&#39;s National Art Library in the
Victoria &amp; Albert Museum details a history of the styles, crafts,
and technologies used in book design.",['design']
3.439547659918051,0552997803,Knowledge of Angels,Jill Paton Walsh,1998,Bantam Pr Ltd,"At once a mystery, an adventure tale, and a medieval fable,
&quot;Knowledge of Angels&quot; is a hauntingly poetic masterpiece.",['castaways']
3.439547659918051,0140442693,The Decameron (Classics S.),Giovanni Boccaccio,1972,Penguin USA,"A collection of tales from this medieval author, which were assembled
in their definitive form between 1349 and 1351.",['english fiction']
3.439547659918051,0231110979,Love Song of the Dark Lord,Barbara Stoler Miller,1997,Columbia University Press,"This is one of the most important works in Indian literature and a
source of religious inspiration in both medieval and contemporary
Vaishnavism.",['poetry']
3.439547659918051,1855329646,"The Moors: The Islamic West 7Th-15th Centuries Ad (Men-at-Arms, 348)","David, Ph.D. Nicolle",2001,Osprey Publishing (UK),"The high point of medieval Islamic expansion was the 700-year presence
of the &#39;Moors&#39; in Spain and Portugal.",['history']
3.3589501205289554,0553275860,Narcissus and Goldmund,Hermann Hesse,1984,Bantam Books,"Leaving the medieval monastary of Mariabronn, Goldmund embarks on a
fantastic journey to recapture his past and discover his future",['fiction']
3.3589501205289554,0746005148,Explorers: From Columbus to Armstrong (Famous Lives),F. Everett,1991,Usborne Books,"Introduces numerous explorers throughout history, including medieval
explorers, polar expeditions, mountain climbers, and space
explorations.",['juvenile nonfiction']
3.3589501205289554,0195113713,Hildegard of Bingen: The Book of the Rewards of Life (Liber Vitae Meritorum),Bruce W. Hozeski,1997,Oxford University Press,"The first and only complete English translation of this important
medieval work, The Book of the Rewards of Life is indeed a handbook of
life.",['religion']
3.3589501205289554,0486292886,The Archaeology of Weapons: Arms and Armour from Prehistory to the Age of Chivalry,R. Ewart Oakeshott,1996,Dover Publications,"British arthority on medieval weapons surveys European arms and armor
from the Bronze Age to the time of triumph of gunpowder.",['history']
3.3589501205289554,022401045X,The ebony tower,John Fowles,1974,Cape,"A NOVELLA AND A COLLECTION OF SHORT STORIES THAT INCLUDE A TRANSLATION
OF A MEDIEVAL FRENCH TALE AND TWO MYSTERIES THAT THE AUTHOR LEAVES
UNSOLVED.",['art']
3.3589501205289554,0399114777,Enchanted pilgrimage,Clifford D Simak,1975,Berkley Pub. Corp. : distributed by Putnam,"The rafter goblin helps Mark Cornwall escape the arm of the
Inquisition in a world where modern and medieval customs coexist.",['science fiction']
3.3589501205289554,0140390545,Mont Saint Michel and Chartres (Penguin Classics),Adams,1986,Penguin Books,"Mont Saint Michel and Chartres is a record not of a literal jouney but
of a meditative journey across time and space into the medieval
imagination.",['history']
3.3589501205289554,0714829498,A History of Illuminated Manuscripts,Christopher De Hamel,1994,Phaidon Press,"Explains how medieval and Renaissance manuscripts were created, tells
how they survived, and surveys a variety of manuscript types",['art']
3.3589501205289554,0809121220,"Richard of St. Victor: The Twelve Patriarchs, the Mystical Ark Book, Three of the Trinity (Classics of Western Spirituality (Paperback))",Grover A. Zinn,1979,Paulist Press,"Here are the writings of the man who was the great link between the
early Christian mystics and the mystical awakening in medieval Europe.",['religion']
3.3589501205289554,0345303822,The Nagasaki Vector,L. Neil Smith,1983,Del Rey Books,"Traveling back in time to medieval Japan, the crew&#39;s mutiny
threatens to strand Captain Gruenblum in the past",['fiction']
3.2991655687735344,0802064981,"William Marshal: Knight-Errant, Baron, and Regent of England (Medieval Academy Reprints for Teaching, 13)",Sidney Painter,1982,University of Toronto Press,"Originally published by Johns Hopkins Press, 1933.",['biography & autobiography']
3.2820431081431636,0801064546,Sacred Legacy: Ancient Writings from Nine Women of Strength and Honor,Myrna Grant,2003,Baker Books,"Inspiring examples of courageous medieval women like Hildegaard and
Teresa of Avila reveal wisdom for today. Includes excerpts of their
writings.",['history']
3.2820431081431636,1570623392,A Troubadour's Testament,JAMES COWAN,1998,Shambhala,"Follows a writer through the Provencal countryside in search of the
truth behind a medieval scroll recording the love of a troubadour for
a young nun",['fiction']
3.2820431081431636,0226437396,"A Poet's Guide to Poetry (Chicago Guides to Writing, Editing, and Publishing)",Mary Kinzie,1999,University of Chicago Press,"Looks at examples of poetry ranging from medieval to modern, discusses
style and mode, and provides exercises for beginning and advanced
writers",['language arts & disciplines']
3.2820431081431636,3791313657,The Bayeux Tapestry: Monument to a Norman Triumph,Wolfgang Grape,1994,Prestel,"One of the great achievements of the medieval world, the Bayeux
Tapestry is brought to life with brilliant reproductions and a vivid,
explanatory narrative text.",['art']
3.2820431081431636,0679889175,First Test (Protector of the Small),Tamora Pierce,2000,Random House Children's Books,"In the medieval and fantastic realm of Tortall, Keladry of Mindelan is
the first girl to take advantage of the decree that permits females to
train for knighthood.",['juvenile fiction']
3.2820431081431636,0553232363,The Forbidden Castle No. 14,Edward Packard,1982,Bantam Books,"The story of the search of a group of medieval English knights for the
Forbidden Castle is designed so that the reader can determine the
course of the action.",['england']
3.2820431081431636,080931150X,Shadows of the Magic Lamp: Fantasy and Science Fiction in Film (Alternatives),George Edgar Slusser,1985,Southern Illinois Univ Pr,"Essays discuss science fiction, animated, and horror films, medieval
romances, and musical fantasies, and their themes, special effects,
and directors",['fiction']
3.2820431081431636,1575660717,Only for You,Hannah Howell,1996,Kensington Publishing Corporation,"A medieval romance in which a young woman seeks revenge for the murder
of her twin only to fall in love with the suspected murderer.",['great britain']
3.2820431081431636,0300093047,Art and Beauty in the Middle Ages,Umberto Eco,2002,Yale Nota Bene,"In this authoritative, lively book, the celebrated Italian novelist
and philosopher Umberto Eco presents a learned summary of medieval
aesthetic ideas.",['art']
3.2820431081431636,0752844237,The Bone-pedlar,Sylvian Hamilton,2001,Orion mass market paperback,". .&#39; This is the world of medieval quest, of castles, journeys,
chance encounters with beggars and spies, of violent killings, and
sometimes of unimaginable cruelty.",['england']
3.2820431081431636,0486218279,More Celtic Fairy Tales,Joseph Jacobs,1968,Dover Publications,"Leprechauns, fairies, and medieval heroes figure in the strange events
related in this paperback reprint of twenty Celtic folk and fairy
tales.",['juvenile fiction']
3.20857860517362,0140440925,Sir Gawain and the Green Knight (Penguin Classics ; L92),Brian Stone,1959,Penguin Books,"The classical medieval poem relating Sir Gawain&#39;s romances, his
conflict with the Green Knight, and return to the Round Table",['fiction']
3.20857860517362,0393097544,Sir Gawain and the Green Knight,M. Borroff,1967,W W Norton & Co,"The classical medieval poem relating Sir Gawain&#39;s romances, his
conflict with the Green Knight, and return to the Round Table",['arthurian romances']
3.20857860517362,0375757112,The Song of Roland (Modern Library Paperback Classics),W. S. Merwin,2001,Modern Library,"A translation of the medieval epic poem about Roland&#39;s adventures
and death in Charlemagne&#39;s war against the pagans.",['fiction']
3.20857860517362,0679722963,The Analects of Confucius,Confucius,1989,Vintage Books USA,"Reveals the original philosophical meaning of the fourth-century B.C.
Chinese writings by eliminating the interpretive nuances attached to
them by medieval translators",['philosophy']
3.20857860517362,1587541165,Tom O'Bedlam,Robert Silverberg,2001,Olmstead Press,"Tom, like the medieval Tom O&#39;Bedlam, can&#39;t decipher the
meaning of the images plaguing his mind.",['fiction']
3.20857860517362,0880290390,Mabinogion,Jeffrey Gantz,1985,Dorset Press,"These eleven medieval Welsh tales were first written down in the 13th
century, but were the product of countless generations of oral
tradition.",['literary criticism']
3.20857860517362,0866119876,Hunchback of Notre Dame (Great Illustrated Classics),Malvina G. Vogel,1994,Playmore Inc. Publishers,"Retells the tale of the hunchbacked bellringer of medieval Notre Dame,
Quasimodo, whose love for the gypsy dancer, Esmeralda, had tragic
consequences.",['juvenile nonfiction']
3.20857860517362,0425180336,This Is All I Ask,Lynn Kurland,2000,Berkley Publishing Group,"National bestselling author Lynn Kurland takes a bold step forward
with this stunning novel that beautifully captures the majesty of the
Medieval period.",['fiction']
3.20857860517362,0895776065,Classical Music: An Introduction to Classical Music Through the Great Composers & Their Masterworks,John Stanley,1994,Putnam Pub Group,"Surveys classical music from the medieval period to the present,
discusses musical instruments, great composers, and major works, and
suggests recordings",['reference']
3.20857860517362,0801492890,Witchcraft in the Middle Ages,Jeffrey Russell,1984,Cornell University Press,"Traces the origin, development and practice of medieval witchcraft
throughout western Europe, and describes the movement&#39;s social and
religious significance","['body, mind & spirit']"
3.20857860517362,0771058586,Arthurian Book of Days,Matthews,1990,McClelland & Stewart,"This book is the first modern book on the Arthurian cycle that
directly links the stories with their original, richly decorated
medieval illustrations.-from jacket.",['arthurian romances']
3.1383316145039672,0747250618,The Last Templar,Michael Jecks,1995,Trafalgar Square Publishing,"Medieval crime. Fourteenth century Devon finds bailiff Simon Puttock
and Knight Sir Baldwin on the trail of burning passion and brutal
revenge.",['fiction']
3.1383316145039672,039487935X,Berenstain Bear's Knight to Remember (Happy House Books),Stan Berenstain,1989,Random House Childrens Pub,"On an archeological dig, Brother and Sister Bear dig up a medieval
knight&#39;s suit of armor and donate it to a museum with surprising
results.",['arms and armor']
3.1383316145039672,0582040523,King Lear: A Parallel Text Edition (Longman Annotated Texts),William Shakespeare,1993,Pearson Education UK,"This major series provides the student with accessible and
authoritative annotated editions of key texts in English and American
literature from medieval to modern times.",['literary collections']
3.1383316145039672,0918720435,"Floure and the Leafe, the Assembly of Ladies, the Isle of Ladies (TEAMS Middle English Texts)",Derek Pearsall,1990,Medieval Institute Publications,"An asset to any study of gender in medieval England, this volume
contains three poems that complement each other in their treatments of
relations between the sexes.",['poetry']
3.1383316145039672,014044453X,The Treasure of the City of Ladies: Or the Book of the Three Virtues (Classics S.),Christine De Pisan,1985,Penguin Books,"Christine de Pisan&#39;s writing is a valuable counterbalance to most
of the rest of our evidence of medieval life which was written by men.",['literary criticism']
3.1383316145039672,0195016572,The Oxford Anthology of English Literature: The Middle Ages Through the 18th Century (Middle Ages Through the Eighteenth Century),Frank Kermode,1973,Oxford University Press,"A fully-annotated, two-volume work which presents the major literary
achievements of English writers from the medieval period to the
twentieth century",['literary collections']
3.1349401102743815,0783554516,What Life Was Like: In the Age of Chivalry : Medieval Europe Ad 800-1500 (What Life Was Like),Time-Life Books,1997,Time-Life Books,Provides an overview of the Middle ages from 800 to 1500 AD,['history']
3.071094319199997,0380752298,The White Raven,Dianna L. Paxson,1989,Harper Mass Market Paperbacks (Mm),"An evocative retelling of an enduring medieveal love story portrays
the ill-fated triangle of Tristan, Isolde, and Mark, in a tale rich
with romance and Celtic fantasy",['fiction']
3.071094319199997,0140440879,Piers the Ploughman (Penguin Classics),William Langland,1959,Penguin Books,"Written by a fourteenth-century cleric, this spiritual allegory
explores man in relation to his ultimate destiny against the
background of teeming, colorful medieval life.",['literary criticism']
3.071094319199997,0851156630,The  Knight and Chivalry : Revised edition,Richard Barber,2000,Boydell Press,"Traces the history of chivalry from the warriors and knights of early
medieval Europe to the chivalric displays which characterised
fifteenth and sixteenth century court life.",['history']
3.071094319199997,0133885135,"History of Western Science, A",Anthony Alioto,1992,Pearson Education POD,"Presented in an informal, narrative style, this text looks at science,
from the ancient world , to medieval science, the scientific
revolution, through to 20th century physics.",['history']
