norm_es_score,isbn,book_title,book_author,year_of_publication,publisher,summary,category
3.071094319199997,1853260681,Hunchback of Notre Dame (Wordsworth Collection),Victor Hugo,1998,NTC/Contemporary Publishing Company,"Retells in simple language the tale of the hunchbacked bellringer of
medieval Notre Dame, Quasimodo, whose love for the gypsy dancer,
Esmeralda, had tragic consequences.",['fiction']
3.071094319199997,0671003364,Ransom,Julie Garwood,1999,Pocket,"For fans of Scottish medieval romances comes this beloved and classic
page-turner from #1 New York Times bestselling author Julie Garwood.",['fiction']
3.071094319199997,0152045643,The Bookstore Mouse,Peggy Christian,2002,Harcourt Paperbacks,"A mouse living in an antiquarian bookstore learns the true power of
words when he literally falls into a medieval tale and helps defeat
the dragon Censor.",['juvenile fiction']
3.071094319199997,0060104333,Celestial chess,Thomas Bontly,1979,Harper & Row,"Researcher David Fairchild finds his work on a medieval manuscript
interrupted when the portion of the library that housed the collection
is closed following a death in the room.",['college teachers']
3.071094319199997,0688074960,The White Raven,Diana L. Paxson,1988,Harpercollins,"An evocative retelling of an enduring medieval love story portrays the
ill-fated triangle of Tristan, Isolde, and Mark, in a tale rich with
romance and Celtic fantasy",['fiction']
3.071094319199997,0253207517,Peasant Fires: The Drummer of Niklashausen,Richard Wunderli,1992,Indiana University Press,"This book is written for the people who are not professional
historians in order to introduce them to late medieval Germany, to
German scholarship, and to a process of thinking about history.",['history']
3.071094319199997,0786830891,The Hunchback of Notre Dame : Illustrated Classic,Gina Ingoglia,1996,Disney Press,"In medieval Paris, Quasimodo, the hunchbacked bellringer of Notre Dame
Cathedral, struggles to save the beautiful gypsy dancer Esmeralda from
being unjustly executed.",['france']
3.071094319199997,0152002030,The Bookstore Mouse,Peggy Christian,1995,Jane Yolen Books,"A mouse living in an antiquarian bookstore learns the true power of
words when he literally falls into a medieval tale and helps defeat
the dragon Censor.",['juvenile fiction']
3.071094319199997,0440226759,The Hunchback of Notre Dame,Victor Hugo,1996,Laurel-Leaf Books,"Retells in simple language the tale of the hunchbacked bellringer of
medieval Notre Dame, Quasimodo, whose love for the gypsy dancer,
Esmeralda, had tragic consequences.",['france']
3.071094319199997,0821749935,Only for You,Hannah Howell,1995,Kensington Pub Corp,"&quot;Only for You&quot; is a medieval story set on the untamed
Scottish border, where a man and a woman risk their hearts on the
stormy battlefield of love.",['england']
3.071094319199997,0809464918,The Natural World (Time Frame),Time Life Editors,1991,Time-Life Books,"Recounts the interrelationship of humans and their environment at the
beginnings of agriculture and stock raising, and in the Mediterranean,
China, medieval Europe, the Americas after the European conquest, and
the modern world",['juvenile nonfiction']
3.0066773965745734,0330292390,The Cats of Seroster (Piccolo Books),Robert Westall,1995,Macmillan Pub Ltd,"In medieval France, huge, powerful cats and a magic dagger help Cam, a
young English jack-of-all-trades, through a series of unusual and
dangerous adventures.",['cats']
3.0066773965745734,0060391693,The Paris Apartment : Romantic Decor on a Flea-Market Budget,Claudia Strasser,1997,Regan Books,"Shows how to decorate one&#39;s apartment using romantic themes,
including a Moorish palace, Parisian cabaret, medieval tower, and a
Victorian parlor",['house & home']
3.0066773965745734,0300042078,Art and Beauty in the Middle Ages,Umberto Eco,1988,Yale University Press,"In this authoritative and lively book, Unberto Eco, the celebrated
Italian novelist and philosopher, examines the development of some of
the principal aesthetic theories and problems of medieval Latin
civilization.","['aesthetics, medieval']"
3.0066773965745734,0802132960,Seven Centuries of English Cooking: A Collection of Recipes,Maxime De LA Falaise,1992,Grove Press,"Rich with the historical sense of taste, this book allows you to cook
the rudiments of a medieval royal banquet, an Elizabethan nursery
breakfast, or an eighteenth-century tavern lunch.",['cooking']
3.0066773965745734,0192852116,Time in History: Views of Time from Prehistory to the Present Day,G.J. Whitrow,1989,Oxford Univ Pr (T),"Discusses how time was considered and measured in ancient and medieval
times, profiles the development of more accurate timepieces, and shows
the changes that occured as the new developments spread",['science']
3.0066773965745734,1578563992,The Last Storyteller,DIANE NOBLE,2004,WaterBrook Press,"Evoking the mysterious and beautiful ways God reaches across
generations, &quot;The Last Storyteller&quot; interweaves a medieval
adventure story with the dilemmas of contemporary romance.",['fiction']
2.9449077794103546,0515127493,"The Irish Devil (Irish Eyes Romance Series, 1)",Donna Fletcher,2000,Jove Books,"Medieval Ireland&#39;s fiercest warrior chooses an outcast healer
woman for his bride, struggling against pressures from within their
own community. Original.",['fiction']
2.9449077794103546,0060525355,The Canterbury Papers : A Novel of Suspense,Judith Healey,2003,William Morrow,"Set in lavishly described medieval England and France, The Canterbury
Papers is an enthralling and suspenseful debut novel combining dark
family secrets, duplicity, and a missing heir to the throne.",['fiction']
2.9449077794103546,0590566458,"Tick Tock, You're Dead! (Give Yourself Goosebumps, No 2)",R. L. Stine,1995,Scholastic,"A terrifying tour through a medieval castle, a close-up look at
ferocious dinosaurs, and a shivery vision of the future are just three
of the twenty adventures readers can experience.",['juvenile fiction']
2.9449077794103546,0743418093,Milady's Dragon,Cathy East Dubowski,2001,Simon Spotlight Entertainment,"Fed up with the lack of courtesy in modern society, Sabrina visits the
local Medieval Faire and gets the idea to visit the age of chivalry,
but she is not prepared for everything that entails.",['juvenile fiction']
2.9449077794103546,0385322623,"Ezra's Quest: Follow That Dog!/Book, Crayon and Eraser",Rosalyn Schanzer,1994,Doubleday Books,"In order to find his dog, a boy must make his way through a series of
mazes each of which is accompanied by information about life in
medieval times.",['juvenile nonfiction']
2.9449077794103546,0679890610,"Viking Ships At Sunrise (Magic Tree House 15, paper)",Mary Pope Osborne,1998,Random House Children's Books,"Their magic tree house takes Jack and Annie back to a monastery in
medieval Ireland, where they try to retrieve a lost book while being
menaced by Viking raiders.",['juvenile fiction']
2.9449077794103546,0440418224,Matilda Bone,Karen Cushman,2002,Yearling Books,"Fourteen-year-old Matilda, an apprentice bonesetter and practitioner
of medicine in a village in medieval England, tries to reconcile the
various aspects of her life, both spiritual and practical.",['juvenile fiction']
2.9449077794103546,0312870000,A Mortal Bane,Roberta Gellis,1999,Forge,"The death of a messenger in medieval London lands a knight, Sir
Bellamy of Itchen, at the head of an investigation into the goings-on
at the notorious Old Priory Guesthouse in Southwark. 15,000 first
printing.",['fiction']
2.9449077794103546,097044902X,The Summoning Stone (The Dragonfire Fantasy Series),Jana G. Oliver,2002,Magespell Press,"Book Two of the DragonFire Fantasy Series -- A rich and engrossing
tale of Celtic magic, warriors and scheming dragons set in a medieval
world. Suitable for ages 13 and above.",['fiction']
2.9449077794103546,067187215X,The CRUSADE OF THE FLAMING SWORD (HARDY BOYS 131) : THE CRUSADE OF THE FLAMING SWORD (Hardy Boys),Franklin W. Dixon,1995,Aladdin,"Joining in the fun of Avalon, a touring medieval fair, the Hardy boys
are alarmed by a series of mysterious accidents that are accompanied
by ominous notes that threaten to bring ruin to the fairgrounds.
Original.",['juvenile fiction']
2.9449077794103546,0691001871,Power in the Portrayal: Representations of Jews and Muslims in Eleventh- and Twelfth-Century Islamic Spain.,Ross Brann,2002,Princeton University Press,"The novel approach illuminates nuances of respect, disinterest,
contempt, and hatred reflected in the relationship between Muslims and
Jews in medieval Spain. &quot;This book is a significant contribution
to the field.",['history']
2.9449077794103546,0060974109,The Woman of Wyrrd,Lynn V. Andrews,1991,Perennial,"The author describes a mystical journey in which she returned to
medieval England as a young woman named Catherine, studied under
Grandmother, the Woman of Wyrrd, and was initiated into the Sisterhood","['body, mind & spirit']"
2.9449077794103546,0671709526,DARK WISPERS : DARK WISPERS,Goodyear Roger,1992,Pocket,"Facing a chaste marriage to a boy-child, medieval lady Alyce falls for
the dark charms of Rhodare, a knight known to all as &quot;Demon
Dare.&quot; Original.",['fiction']
2.9449077794103546,0312421672,Narcissus and Goldmund : A Novel,Hermann Hesse,2003,Picador,"Leaving behind the medieval monastary of Mariabronn at the urgings of
his instructor, Narcissus, Goldmund embarks on a fantastic journey to
recapture his past and discover his future. Reprint.",['fiction']
2.8856252491248084,1886449120,How to Spin Gold: A Woman's Tale,Elizabeth Cunningham,1997,Barrytown Limited,"Taking its inspiration from the story of Rumpelstiltskin and the
spinner of gold, a novel tells the story of a mysteriously deformed
girl from a medieval village. By the author of The Return of the
Goddess. IP.",['fiction']
2.8856252491248084,1556612001,"Mandie and the Jumping Juniper (Mandie Book, No. 18)",Lois Gladys Leppard,1991,Bethany House,"Visiting the medieval stone castle of Baroness Geissler with Jonathan,
Uncle Ned, and Senator Morton, Mandy investigates the mystery of its
very old juniper that is sometimes said to jump",['juvenile fiction']
2.8856252491248084,0380781468,Beyond Scandal,Brenda Joyce,1995,Avon,"Brenda Joyce is a dreamweaver who spins spells that entice and
enchant, a masterful creator of unforgettable characters and
incomparableromance-from the spellbinding medieval passion of promise
of the rose to the breathtaking sensual ...",['fiction']
2.8856252491248084,1570822794,Disney's the Hunchback of Notre Dame: Meet the Characters (Meet the Characters Series),Mouse Works,1996,Mouse Works,"A retelling, based on the film, of how Quasimodo, the hunchbacked
bellringer of Notre Dame Cathedral in medieval Paris, saves the
beautiful gypsy dancer Esmeralda from being unjustly executed.",['paris (france)']
2.8856252491248084,0425182371,The Very Thought of You,Lynn Kurland,2001,Berkley Publishing Group,"A medieval map leads corporate exec Alexander Smith on a journey back
in time where a beautiful woman helps him rediscover his own
chivalrous--and passionate--heart.",['fiction']
2.8856252491248084,0394585070,Catapult: Harry and I Build a Siege Weapon,Jim Paul,1991,Random House Inc,"As two modern-day men attempt to build a medieval siege engine or
catapult, the author offers an imaginative, introspective reflection
on the nature of war, the history of weaponry, and the nature of
friendship",['science']
2.8856252491248084,0553107054,Orsinian tales,Ursula K. Le Guin,1977,Bantam Books,"The place is Orsinia, a land of medieval keeps standing guard above
walled cities, and of railways stretching across karsts to vanish in
mountains where the old gods still live.","['fantasy fiction, american']"
2.8856252491248084,0523423241,A Trembling upon Rome,Richard Condon,1985,Pinnacle Books,"Elevated to the papacy and involved with two remarkable mistresses,
Baldassare Cossa--lawyer, soldier, and prelate--becomes embroiled in
the political intrigue, financial machinations, and violence of late
medieval Italy",['fiction']
2.8856252491248084,0156005565,Catapult: Harry and I Build a Siege Weapon,Jim Paul,1997,Harvest Books,"As two modern-day men attempt to build a medieval siege engine or
catapult, the author offers an imaginative, introspective reflection
on the nature of war, the history of weaponry, and the nature of
friendship",['technology & engineering']
2.8856252491248084,0791416208,Gnosis: An Esoteric Tradition of Mystical Visions and Unions (Suny Series in Western Esoteric Traditions),Daniel Merkur,1993,State University of New York Press,"Traces the use of powerful gnostic visionary techniques from
Hellenistic Gnosticism and Jewish merkabah mysticism, through
Muhammad, the Ismaeilis, and theosophical Sufism to medieval
neoplatonism, and renaissance alchemy.",['religion']
2.8856252491248084,1931484201,Forge #4,Chris Oarr,2002,Cross Generation Comics,"This series combines five different stories in one volume, with each
issue taking the reader on a journey through many different genres,
including science fiction and medieval mysteries.",['comics & graphic novels']
2.8856252491248084,0520218752,Dust: A History of the Small and the Invisible,Joseph A. Amato,2000,University of California Press,"A history of this minute particle spans a thousand years of Western
Civilization, from the naturalism of the medieval period though the
intensely curious Renaissance, to the modern worlds of nanotechnology
and viral research.",['science']
2.8286818517413552,0521398266,The Pastons and their England : Studies in an Age of Transition (Canto original series),H. S. Bennett,1990,Cambridge University Press,"The Paston letters recreate through correspondence the lives of an
ordinary affluent 15th century family, revealing many aspects of
everyday life as well as the changing face of the medieval English
countryside.",['history']
2.8286818517413552,0395978270,A Single Shard (Newbery Medal Book),Linda Sue Park,2001,Clarion Books,"Tree-ear, a thirteen-year-old orphan in medieval Korea, lives under a
bridge in a potters&#39; village, and longs to learn how to throw the
delicate celadon ceramics himself.",['juvenile fiction']
2.8286818517413552,048622791X,The Wood Beyond the World,William Morris,1972,Dover Publications,"A wonderful fantasy set in a medieval never-never land, reprinted here
as a facsimile of the beautiful Kelmscott Press edition. Morris was
source behind Dunsany, Tolkien, C.S. Lewis, etc.",['art']
2.8286818517413552,0380757265,Alchemy Unlimited,Douglas W. Clark,1990,Harper Mass Market Paperbacks,"Corwyn, the world&#39;s only aquatic alchemist, and his apprentice,
Sebastian, struggle to save their medieval town of Pomme de Terre from
an evil epidemic of demonic possession",['fiction']
2.8286818517413552,0312861591,The Dragon in Lyonesse,Gordon R. Dickson,1998,St Martins Pr,"Mathematician Jim Eckert, who has come to live in magical medieval
times and can become a dragon at will, becomes an unlikely ally of
King Arthur and his Knights of the Round Table",['fiction']
2.8286818517413552,0821742841,Lady of the Forest,Jennifer Roberson,1993,Zebra Books,"Against a medieval tapestry of color and pageantry, Roberson weaves a
rich, sweeping tale of a woman who, for the love of one man and the
good of all men, defies destiny and becomes a legend.",['fiction']
2.8286818517413552,0140382534,The Hunchback of Notre-Dame (Puffin Classics),Victor Hugo,1997,Puffin Books,"An abridgement of the tale, set in medieval Paris, of Quasimodo, the
hunchbacked bellringer of Notre Dame Cathedral, and his struggles to
save the beautiful gypsy dancer Esmeralda from being unjustly
executed.",['juvenile fiction']
2.8286818517413552,0312953607,The Apothecary Rose : An Owen Archer Mystery (An Owen Archer Mystery),Candace Robb,1994,St. Martin's Paperbacks,"Medieval detective Owen Archer must investigate a fatal medicine
administered to the English Lord Chancellor by the Master Apothecary
and resist loving a prime suspect, the apothecary&#39;s wife",['fiction']
2.8286818517413552,0380773856,Hour of the Rose (Draycott Abbey Novels),Christina Skye,1994,Avon,"When a rugged ex-Royal Marine Commando and a beautiful archaeologist
arrive at Draycott Abbey, they are fated to repeat the romance of a
pair of tragic lovers in the Abbey&#39;s medieval past.",['fiction']
2.8286818517413552,1564147118,Grimoire for the Apprentice Wizard,Oberon Zell-Ravenheart,2004,New Page Books,"An essential reference and permanent resource for every aspirant. It
is illustrated with original art by Oberon and friends, hundreds of
woodcuts from medieval manuscripts and alchemical texts, as well as
charts, tables and diagrams.",['reference']
2.8286818517413552,0307302989,Disney's the Hunchback of Notre Dame (Little Golden Books),Justine Korman,1996,Random House Childrens Books,"A retelling of the tale, set in medieval Paris, of Quasimodo, the
hunchbacked bellringer of Notre Dame Cathedral, and his struggles to
save the beautiful gypsy dancer Esmaralda from being unjustly
executed.",['juvenile fiction']
2.8286818517413552,0425162958,"Remedy for Treason (Roe, Caroline. Chronicles of Isaac of Girona.)",Caroline Roe,1998,Prime Crime,"A medieval medical mystery featuring Isaac, a blind Jewish physician
in fourteenth-century Spain, who steps into the path of a plot to
destroy the monarchy while the plague rages across Europe.",['fiction']
2.8286818517413552,0394500326,Peter the Great: His Life and His World,Robert K. Massie,1980,Random House Inc,"This meticulous biography of the notorious Russian ruler examines his
background and accomplishments, detailing the armed conflicts during
his reign and scrutinizing his transformation of medieval Russia into
modern Russia",['russia']
2.8286818517413552,0312869940,White Rose (War of the Roses),R. Garcia y Robertson,2004,Forge Books,". . Robyn is a charming and resourceful heroine; Garcia y Robertson
deftly plays up the contrast between Robyn&#39;s 20th-century
sensibilities and the medieval surroundings for comic effect.",['fiction']
2.8286818517413552,0765303779,The Outcast Dove (Catherine LeVendeur),Sharan Newman,2003,Forge Books,"The secret cousin of Catherine Le Vendeur, Jewish financial overseer
Solomon travels to medieval Spain and finds himself drawn into the
rescue of a Jewish girl taken during the conquest of Alveira.",['fiction']
2.8286818517413552,0307103781,Disney's the Hunchback of Notre Dame (Big Golden Book),Justine Korman,1996,Random House Childrens Books,"A retelling of the tale, set in medieval Paris, of Quasimodo, the
hunchbacked bellringer of Notre Dame Cathedral, and his struggles to
save the beautiful gypsy dancer Esmaralda from being unjustly
executed.",['juvenile fiction']
2.8286818517413552,0486285642,The Hunchback of Notre Dame (Dover Children's Thrift Classics),Victor Hugo,1995,Dover Publications,"A retelling of the tale, set in medieval Paris, of Quasimodo, the
hunchbacked bellringer of Notre Dame Cathedral, and his struggles to
save the beautiful gypsy dancer Esmaralda from being unjustly
executed.","[""children's stories""]"
2.8286818517413552,055357566X,Betrothed,Elizabeth Elliott,1996,Bantam,"The sequel to The Warlord recounts the medieval romance between Baron
Guy of Montague and Lady Claudia Chiavari, whose uncle forces Montague
into an engagement with his beautiful but recalcitrant niece.
Original.",['fiction']
2.773942384580081,0345346998,The Folk of the Air,Peter S. Beagle,1988,Del Rey Books,"While attending the revels of the League for Archaic Pleasurs, a group
dedicated to the pleasures of the medieval period, Joe Farrell comes
face-to-face with Nicholas Bonner, a spirit from the past and an
ancient evil",['fiction']
2.773942384580081,034530358X,Tender Warrior,Fern Michaels,1991,Ivy Books,"The legendary Spanish warrior, El Cid, kidnaps the beautiful Princess
Mirjana and holds her for ransom, but is unable to resist falling in
love with her, in a classic romance set in medieval Spain. Reprint.",['fiction']
2.773942384580081,0441166113,The Dragon at War,Gordon R. Dickson,1993,Ace Books,"Magically transported to medieval England and empowered with special
gifts, Jim Eckert is challenged to protect England from an invasion of
the French army, which has aligned itself with the mighty serpents of
the deep",['fiction']
2.773942384580081,0062511157,The Book of Courtly Love: The Passionate Code of the Troubadours,Andrea Hopkins,1994,Harpercollins,"A treasury of French medieval lore combines the tales of Lancelot and
Guinevere, Tristan and Isolde, Troilus and Criseyde, and several songs
and poems with sixty accompanying illustrations from classic
manuscripts and romantic art.",['courtly love in literature.']
2.773942384580081,0312142870,The Book of Shadows,C. L. Grace,1996,St. Martin's Press,"When necromancer and blackmailer Tenebrae is found murdered, medieval
physician and herbalist Kathryn Swinbrooke is called to the scene and
attempts to solve a locked-room scenerio in which all present seem to
be innocent",['fiction']
2.773942384580081,0521440491,"The Cambridge Illustrated Atlas of Warfare : The Middle Ages, 768-1487 (Cambridge Illustrated Atlases)",Nicholas Hooper,1996,Cambridge University Press,"An authoritative, illustrated history of medieval warfare combines
maps, battle plans, and pictorial essays to explore such topics as
fortifications, weaponry, the use of cavalry, siege warfare, strategy
and theory, and individual battles ...",['history']
2.773942384580081,0393020290,Library: An Unquiet History,Matthew Battles,2003,W.W. Norton & Company,"Provides an intriguing historical study of libraries and books, their
preservation, and destruction, from the U.S. to Europe and Asia, from
medieval monasteries and Vatican collections to the ever-changing
information highway of today. 10 ...",['language arts & disciplines']
2.773942384580081,0312980132,"Eat, Drink, and be Buried (Gourmet Detective)",Peter King,2002,St. Martin's Minotaur,"When a family of eccentrically dysfunctional British aristocrats hires
the Gournet Detective for their medieval-themed banquet hall, he
witnesses the murder of a professional joustman and finds himself the
prime suspect in the poisoning.",['fiction']
2.773942384580081,1563335506,Golden Age of Promiscuity,Gooch,1996,Masquerade Books Inc,"The novel brings to life a night world that no longer exists, a
subterranean New York of drugs, dim lights, and strange bare rooms
where medieval-seeming acts are performed and intimacy is anonymous.",['gay men']
2.773942384580081,0375802975,"Knights And Castles (Magic Tree House Research Guide, paper)",WILL AND MA OSBORNE,2000,Random House Books for Young Readers,"Jack and Annie look at knights, armor, and life in a castle. What was
it like to wear armor? What was the food like in castles? This book
explores what life was really like in medieval times.",['juvenile nonfiction']
2.773942384580081,0821760955,Highland Honor,Hannah Howell,1999,Zebra Books,"In medieval France, Gisele is falsely accused of murdering her
prominent husband until Nigel Murray, a fierce Scottish mercenary,
saves her life and will stop at nothing to win her love",['fiction']
2.773942384580081,0140085807,McGarr and the Sienese Conspiracy (Penguin Crime Fiction),Bartholomew Gill,1986,Penguin USA,"Inspector McGarr&#39;s investigation into the murder of three high-
ranking members of the British Secret Service takes him to an oil rig
in the North Sea and to the medieval town of Siena in Italy",['fiction']
2.773942384580081,0743453263,The Devil's Cloth : A History of Stripes,Michel Pastoureau,2003,Washington Square Press,"A French scholar and author of Blue: The History of a Color presents a
witty cultural and social history of stripes, from the medieval
prejudice against stripes to the present day, looking at the
frequently negative attitude and ...",['history']
2.773942384580081,1860199976,Wars of the Roses,Robin Neillands,1994,Brockhampton Press,"The vicious wars between the English noble houses of York and
Lancaster marked the end of medieval England and the birth of the
Renaissance. The story of the Wars of the Roses is nothing if not
complex. Even its beginning is uncertain.",['great britain']
2.773942384580081,0789414910,DK Classics: Hunchback Of Notre Dame,Victor Hugo,1997,Dorling Kindersley Publishing,"Illustrated notes throughout the text explain the historical
background of the story. Set in medieval Paris, Victor Hugo tells with
compassion the tragic story of Quasimodo, the deformed bellringer of
Notre-Dame Cathedral.",['juvenile fiction']
2.773942384580081,0486203514,The Guide for the Perplexed,Moses Maimonides,2000,Dover Publications,"Complete text of crucial medieval work of philosophy: reconciliation
of Aristotle and Scripture. Includes Life of Maimonides, analysis of
The Guide, indexes of quotations from Scripture, Talmud. Maimonides,
brilliant forerunner of Aquinas.",['philosophy']
2.773942384580081,0140192468,The Sleepwalkers: A History of Man's Changing Vision of the Universe (Arkana S.),Arthur Koestler,1990,Penguin Books,"Bringing the history of cosmology--from the Babylonians to Newton--to
life in a masterly synthesis, Koestler shows how the modern world-view
replaced the medieval world-view in the scientific revolution of the
seventeenth century.","['body, mind & spirit']"
2.773942384580081,0500276455,The Middle Ages: A Concise Encyclopedia,H. R. Lyon,1991,W W Norton & Co Inc,"Nearly 1,000 entries provide information on the whole range of
medieval history including biographies, chivalry, feudalism, heresy,
science, major battles, treaties, dynasties, artistic highlights, and
the role of women.","['civilization, medieval']"
